<?xml version="1.0" encoding="UTF-8"?>
<company:aircompany name="BekAirs"
            xmlns:company="http://www.bekair.com"
            xmlns:xsi="http://www.w3.org/2001/XMLSchema-instance"
            xsi:schemaLocation="aircompanyXSD.xsd">
    <planes>
        <plane model="IL86"/>

        <plane model="SuperJet100"/>

        <plane model="TU134"/>

        <plane model="TU154"/>

        <plane model="TU154"/>

    </planes>
    <departments>
        <department type="technical">
            <staff_list>
                <technical_staff>
                    <position>Chief Engineer</position>
                    <salary>150000</salary>
                </technical_staff>
                <technical_staff>
                    <position>Assistant Chief Engineer</position>
                    <salary>90000</salary>
                </technical_staff>
                <technical_staff>
                    <position>Flight Engineer</position>
                    <salary>65000</salary>
                </technical_staff>
                <technical_staff>
                    <position>Flight Engineer</position>
                    <salary>65000</salary>
                </technical_staff>
                <technical_staff>
                    <position>Flight Engineer</position>
                    <salary>65000</salary>
                </technical_staff>
            </staff_list>
        </department>
        <department type="flight">
            <staff_list>
                <pilot>
                    <position>Chief Pilot</position>
                    <salary>180000</salary>
                </pilot>
                <pilot>
                    <position>Chief Pilot</position>
                    <salary>180000</salary>
                </pilot>
                <pilot>
                    <position>Second Pilot</position>
                    <salary>130000</salary>
                </pilot>
                <pilot>
                    <position>Second Pilot</position>
                    <salary>130000</salary>
                </pilot>
                <pilot>
                    <position>Second Pilot</position>
                    <salary>130000</salary>
                </pilot>
                <pilot>
                    <position>Second Pilot</position>
                    <salary>130000</salary>
                </pilot>
                <airsteward>
                    <position>Steward</position>
                    <salary>85000</salary>
                </airsteward>
                <airsteward>
                    <position>Steward</position>
                    <salary>85000</salary>
                </airsteward>
                <airsteward>
                    <position>Steward</position>
                    <salary>85000</salary>
                </airsteward>
                <airsteward>
                    <position>Steward</position>
                    <salary>85000</salary>
                </airsteward>
                <airsteward>
                    <position>Steward</position>
                    <salary>85000</salary>
                </airsteward>

            </staff_list>
        </department>
    </departments>

</company:aircompany>